<?xml version="1.0" encoding="UTF-8"?>
<za:Zahtev xmlns="http://www.w3.org/ns/rdfa#"
 xmlns:za="http://www.ftn.uns.ac.rs/xml/tim11/zahtev"
 xmlns:xsi="http://www.w3.org/2001/XMLSchema-instance"
 xsi:schemaLocation="http://www.ftn.uns.ac.rs/xml/tim11/zahtev file:/C:/Dev/Faks/xml/xml-projekat/data/xsd/zahtevcir.xsd" vocab="http://www.ftn.uns.ac.rs/xml/tim11/predicate" about="http://www.ftn.uns.ac.rs/xml/tim11/zahtev/1234">
    <za:Organ>
        <za:Naziv property="izdatoOdStrane" datatype="xs:string">Naziv0</za:Naziv>
        <za:Sediste>Sediste0</za:Sediste>
    </za:Organ>
    <za:Zahtevi>
        <za:Informacije>Informacije0</za:Informacije>
    </za:Zahtevi>
    <za:OstaliPodaci>
        <za:Mesto property="podnesenU" datatype="xs:string">Mesto0</za:Mesto>
        <za:Datum property="podnesenDatuma" datatype="xs:date">2006-05-04</za:Datum>
    </za:OstaliPodaci>
    <za:TrazilacInformacija vocab="http://www.ftn.uns.ac.rs/xml/tim11/predicate" about="http://www.ftn.uns.ac.rs/xml/tim11/gradjanin/1234" rel="podneoZahtev" href="http://www.ftn.uns.ac.rs/xml/tim11/zahtev/1234">
        <za:Ime property="imeTrazioca" datatype="xs:string">Ime0</za:Ime>
        <za:Prezime property="prezimeTrazioca" datatype="xs:string">Prezime0</za:Prezime>
        <za:Adresa>Adresa0</za:Adresa>
        <za:Kontakt>Kontakt0</za:Kontakt>
    </za:TrazilacInformacija>
</za:Zahtev>
